{
  "schema_version": "0.1",
  "run_id": "001_bottle_selfie",
  "ask": "A woman films herself opening a water bottle and drinking, 8 seconds, phone selfie.",
  "model": "seedance",
  "clip": {
    "duration_s": 8,
    "duration_origin": "USER_EXPLICIT",
    "aspect_ratio": "9:16",
    "fps_assumed": 24,
    "objective": "a believable, unforced moment: she opens the bottle and drinks, nothing performed",
    "dramatic_function": "small everyday relief; the drink is the payoff of the open"
  },
  "pass_plan": [
    {"pass": "intent", "active": true, "reason": "mandatory"},
    {"pass": "entity", "active": true, "reason": "mandatory"},
    {"pass": "world", "active": false, "reason": "no research; reasoned: no environment reaction beyond the bottle itself"},
    {"pass": "action", "active": false, "reason": "no research; reasoned: seated upper-body action fully described by the interaction stages"},
    {"pass": "interaction", "active": true, "reason": "actor touches a bottle and its cap"},
    {"pass": "physics", "active": true, "reason": "a contact (twist) with a stated reaction (cap comes free, water moves)"},
    {"pass": "staging", "active": false, "reason": "no research; reasoned: one actor, one object, fixed camera"},
    {"pass": "continuity", "active": true, "reason": "bottle, cap and water level persist across beats"},
    {"pass": "time", "active": true, "reason": "mandatory"},
    {"pass": "performance", "active": true, "reason": "a living performer is on screen"},
    {"pass": "camera", "active": true, "reason": "mandatory: explicit camera grammar"},
    {"pass": "attention", "active": false, "reason": "no research; reasoned: nothing is withheld or revealed"},
    {"pass": "light_color", "active": false, "reason": "no research; reasoned: available flat light stated in the capture texture"},
    {"pass": "style", "active": true, "reason": "a real phone look is implied by 'films herself'"},
    {"pass": "audio", "active": false, "reason": "no research; model audio support unknown; no dialogue asked"},
    {"pass": "synthesis", "active": true, "reason": "mandatory"}
  ],
  "entities": [
    {"id": "woman", "kind": "actor", "description": "A woman in her late twenties with her hair tied back, in a plain T-shirt, sitting at a kitchen table", "short": "A woman, hair tied back, plain T-shirt, at a kitchen table", "locks": ["identity_stable", "anatomy_correct"], "origin": "CREATIVE_CHOICE"},
    {"id": "bottle", "kind": "object", "description": "A clear plastic water bottle with a white screw cap, label facing the camera, water about two-thirds full", "short": "A clear plastic water bottle, white screw cap, label to camera", "locks": ["scale", "colour", "label_readable", "shape"], "origin": "INFERENCE"},
    {"id": "bottle_cap", "kind": "object", "description": "", "locks": ["stays_visible_after_removal"], "origin": "INFERENCE"},
    {"id": "phone", "kind": "camera", "description": "Her phone is propped against a mug on the table, front camera facing her, so both hands are free", "short": "Her phone is propped against a mug, front camera on her, both hands free", "origin": "PROJECT_DERIVED"},
    {"id": "table", "kind": "surface", "description": "", "origin": "INFERENCE"}
  ],
  "hands": [
    {"actor": "woman", "hand": "left", "beat": "b1", "state": "free"},
    {"actor": "woman", "hand": "right", "beat": "b1", "state": "free"},
    {"actor": "woman", "hand": "left", "beat": "b2", "state": "holding:bottle"},
    {"actor": "woman", "hand": "right", "beat": "b2", "state": "holding:bottle_cap"},
    {"actor": "woman", "hand": "left", "beat": "b3", "state": "holding:bottle"},
    {"actor": "woman", "hand": "right", "beat": "b3", "state": "holding:bottle_cap"},
    {"actor": "woman", "hand": "left", "beat": "b4", "state": "holding:bottle"},
    {"actor": "woman", "hand": "right", "beat": "b4", "state": "holding:bottle_cap"},
    {"actor": "woman", "hand": "left", "beat": "b5", "state": "holding:bottle"},
    {"actor": "woman", "hand": "right", "beat": "b5", "state": "holding:bottle_cap"},
    {"actor": "woman", "hand": "left", "beat": "b6", "state": "holding:bottle"},
    {"actor": "woman", "hand": "right", "beat": "b6", "state": "holding:bottle_cap"},
    {"actor": "woman", "hand": "left", "beat": "b7", "state": "holding:bottle"},
    {"actor": "woman", "hand": "right", "beat": "b7", "state": "holding:bottle_cap"}
  ],
  "pathways": [
    {
      "id": "p_open",
      "object": "bottle",
      "parts": ["bottle_cap"],
      "end_state": "cap_off_held_in_right_fingers_bottle_open_in_left_hand",
      "origin": "INFERENCE",
      "stages": [
        {"id": "s1", "kind": "precondition", "beat": "b1", "hands_required": 0, "hands": [], "state_before": "sealed_on_table", "state_after": "sealed_on_table", "description": "bottle sealed on the table; phone propped; both hands free"},
        {"id": "s2", "kind": "anticipation", "beat": "b2", "hands_required": 0, "hands": [], "state_before": "sealed_on_table", "state_after": "sealed_on_table", "description": "small breath; gaze drops to the bottle; hands move toward it"},
        {"id": "s3", "kind": "contact", "beat": "b2", "hands_required": 2, "hands": [{"actor": "woman", "hand": "left"}, {"actor": "woman", "hand": "right"}], "state_before": "sealed_on_table", "state_after": "sealed_in_hands", "description": "left hand wraps the body in a full grip; right thumb and index pinch the cap"},
        {"id": "s4", "kind": "transfer", "beat": "b3", "hands_required": 2, "hands": [{"actor": "woman", "hand": "left"}, {"actor": "woman", "hand": "right"}], "state_before": "sealed_in_hands", "state_after": "cap_loosened", "description": "one short counter-clockwise twist; the cap turns, the body stays still"},
        {"id": "s5", "kind": "effect", "beat": "b4", "hands_required": 2, "hands": [{"actor": "woman", "hand": "left"}, {"actor": "woman", "hand": "right"}], "state_before": "cap_loosened", "state_after": "cap_off", "reaction": "the cap comes free with a small click and lifts away in her right fingers; the bottle mouth is open; a faint ripple runs through the water", "description": "seal breaks"},
        {"id": "s6", "kind": "follow_through", "beat": "b4", "hands_required": 1, "hands": [{"actor": "woman", "hand": "right"}], "state_before": "cap_off", "state_after": "cap_off", "description": "right hand lifts the cap clear, still pinched"},
        {"id": "s7", "kind": "recovery", "beat": "b5", "hands_required": 1, "hands": [{"actor": "woman", "hand": "left"}], "state_before": "cap_off", "state_after": "cap_off_held_in_right_fingers_bottle_open_in_left_hand", "description": "left hand raises the open bottle; right hand lowers the cap toward the table edge"},
        {"id": "s8", "kind": "postcondition", "beat": "b5", "hands_required": 0, "hands": [], "state_before": "cap_off_held_in_right_fingers_bottle_open_in_left_hand", "state_after": "cap_off_held_in_right_fingers_bottle_open_in_left_hand", "description": "bottle open in the left hand, cap visible in the right"}
      ]
    },
    {
      "id": "p_drink",
      "object": "bottle",
      "parts": ["bottle_cap"],
      "end_state": "bottle_lowered_water_level_lower",
      "origin": "INFERENCE",
      "stages": [
        {"id": "d1", "kind": "anticipation", "beat": "b5", "hands_required": 1, "hands": [{"actor": "woman", "hand": "left"}], "state_before": "open_raised", "state_after": "open_raised", "description": "bottle rises toward her mouth; eyes glance down to it"},
        {"id": "d2", "kind": "contact", "beat": "b6", "hands_required": 1, "hands": [{"actor": "woman", "hand": "left"}], "state_before": "open_raised", "state_after": "rim_at_lips", "description": "rim meets her lips"},
        {"id": "d3", "kind": "transfer", "beat": "b6", "hands_required": 1, "hands": [{"actor": "woman", "hand": "left"}], "state_before": "rim_at_lips", "state_after": "tilted_pouring", "description": "she tilts the bottle"},
        {"id": "d4", "kind": "effect", "beat": "b6", "hands_required": 1, "hands": [{"actor": "woman", "hand": "left"}], "state_before": "tilted_pouring", "state_after": "two_swallows_done", "reaction": "her throat moves with two swallows; the water level tilts and drops a little", "description": "two swallows"},
        {"id": "d5", "kind": "follow_through", "beat": "b7", "hands_required": 1, "hands": [{"actor": "woman", "hand": "left"}], "state_before": "two_swallows_done", "state_after": "bottle_lowered_water_level_lower", "description": "she lowers the bottle; a small exhale"},
        {"id": "d6", "kind": "recovery", "beat": "b7", "hands_required": 0, "hands": [], "state_before": "bottle_lowered_water_level_lower", "state_after": "bottle_lowered_water_level_lower", "description": "settle; glance back to the lens"}
      ]
    }
  ],
  "beats": [
    {"id": "b1", "order": 1, "label": "settle in", "actor": "woman", "description": "She leans slightly into frame and glances at the lens; the sealed bottle stands on the table in front of her", "short": "she leans in and glances at the lens; the sealed bottle sits in front of her", "min_s": 0.8, "min_s_origin": "PROJECT_DERIVED convention (establish beat)", "after": [], "caused_by": [], "key_pose": "head and shoulders centred, bottle visible lower frame", "importance": 0.6, "origin": "CREATIVE_CHOICE"},
    {"id": "b2", "order": 2, "label": "reach and grip", "actor": "woman", "description": "After a small breath she reaches down; her left hand wraps the bottle body and her right thumb and index finger pinch the cap", "short": "she reaches down; left hand wraps the bottle, right fingers pinch the cap", "min_s": 0.8, "min_s_origin": "PROJECT_DERIVED convention (reach + grasp)", "after": ["b1"], "caused_by": [], "key_pose": null, "importance": 0.9, "origin": "PROJECT_DERIVED"},